{
  "schema_version": "zettelkasten-compiler-state@2",
  "protocol": "zettelkasten-v7.1-evidence-first-narrative-alive-dual-plane",
  "prompt_git_blob_sha1": "7f3019f4b41a90728cd48a523d742c7c59721bf6",
  "run_mode": "LOOP",
  "state_channel": "SIDECAR",
  "render_order": "TASK_VALUE_FIRST",
  "render_mode": "PAYLOAD_FIRST",
  "status": "CONTINUE",
  "source_id": "example-source",
  "content_id": "example-content",
  "source_digest": "sha256:0000000000000000000000000000000000000000000000000000000000000000",
  "registry_digest": "sha256:0000000000000000000000000000000000000000000000000000000000000000",
  "source_cursor": {
    "cursor_type": "item",
    "value": 0,
    "complete": false,
    "source_digest": "sha256:0000000000000000000000000000000000000000000000000000000000000000"
  },
  "source_queue_empty": false,
  "baseline_guard_pass": false,
  "quality_gates": {
    "QG-01": {"status": "NOT_RUN", "evidence": [], "failures": []},
    "QG-02": {"status": "NOT_RUN", "evidence": [], "failures": []},
    "QG-03": {"status": "NOT_RUN", "evidence": [], "failures": []},
    "QG-04": {"status": "NOT_RUN", "evidence": [], "failures": []},
    "QG-05": {"status": "NOT_RUN", "evidence": [], "failures": []},
    "QG-06": {"status": "NOT_RUN", "evidence": [], "failures": []},
    "QG-07": {"status": "NOT_RUN", "evidence": [], "failures": []},
    "QG-08": {"status": "NOT_RUN", "evidence": [], "failures": []},
    "QG-09": {"status": "NOT_RUN", "evidence": [], "failures": []},
    "QG-10": {"status": "NOT_RUN", "evidence": [], "failures": []},
    "QG-11": {"status": "NOT_RUN", "evidence": [], "failures": []},
    "QG-12": {"status": "NOT_RUN", "evidence": [], "failures": []},
    "QG-13": {"status": "NOT_RUN", "evidence": [], "failures": []},
    "QG-14": {"status": "NOT_RUN", "evidence": [], "failures": []},
    "QG-15": {"status": "NOT_RUN", "evidence": [], "failures": []},
    "QG-16": {"status": "NOT_RUN", "evidence": [], "failures": []},
    "QG-17": {"status": "NOT_RUN", "evidence": [], "failures": []},
    "QG-18": {"status": "NOT_RUN", "evidence": [], "failures": []},
    "QG-19": {"status": "NOT_RUN", "evidence": [], "failures": []},
    "QG-20": {"status": "NOT_RUN", "evidence": [], "failures": []},
    "QG-21": {"status": "NOT_RUN", "evidence": [], "failures": []},
    "QG-22": {"status": "NOT_RUN", "evidence": [], "failures": []},
    "QG-23": {"status": "NOT_RUN", "evidence": [], "failures": []},
    "QG-24": {"status": "NOT_RUN", "evidence": [], "failures": []}
  },
  "remaining_work": ["load-source-manifest"],
  "blocked_by": [],
  "updated_at": "2026-08-13T00:00:00Z"
}
